{
  "id": "fiba-nike",
  "clubId": null,
  "orgName": "FIBA",
  "sponsorId": "nike",
  "placement": "league-partner",
  "from": null,
  "to": null,
  "value": null,
  "source": {
    "name": "FIBA partners page (fiba.net; JS-rendered)",
    "date": "2026-09-25",
    "url": "https://fiba.net/partners/",
    "note": "Previous URL (about.fiba.basketball/en/partners) serves a soft-404; the partners footer on that error page listed these brands (verified by review fetch 2026-09-27)."
  },
  "leagueId": "fiba",
  "note": "FIBA Partner; the FIBA World Ranking for Men is 'presented by Nike' per FIBA's Turkiye qualification article (31 Aug 2026)."
}
