{
  "id": "dp-world-wasl-properties",
  "clubId": null,
  "orgName": "DP World Tour",
  "sponsorId": "wasl-properties",
  "placement": "league-partner",
  "from": "2026",
  "to": null,
  "value": null,
  "source": {
    "name": "DP World Tour / event partner pages (see note)",
    "date": "2026-09-25",
    "url": "https://www.europeantour.com/dpworld-tour/",
    "note": "Official Partner of the Dubai Invitational and the Hero Dubai Desert Classic (event sponsors pages, fetched 25 Sep 2026). wasl.ae about-us: founded 25 May 2008 'from the union of the Dubai Development Board and Real Estate Department' and manages 'assets entrusted to us by DREC'; Dubai state lineage is the company's own history page, but an explicit 'Government of Dubai owner' statement was not found, so no owner linked."
  }
}