{
  "id": "euroleague-spalding",
  "clubId": null,
  "orgName": "Euroleague Basketball",
  "leagueId": "euroleague",
  "sponsorId": "spalding",
  "placement": "league-partner",
  "from": null,
  "to": null,
  "value": null,
  "source": {
    "name": "EuroLeague Basketball, Marketing Partners page (Wayback snapshot 7 Feb 2026)",
    "date": "2026-02-07",
    "url": "https://web.archive.org/web/20260207223442/https://www.euroleaguebasketball.net/marketing-partners/"
  },
  "note": "Official Partner."
}
