{
  "id": "sailgp-mubadala",
  "clubId": null,
  "orgName": "SailGP",
  "sponsorId": "mubadala",
  "placement": "league-partner",
  "from": "2023",
  "to": null,
  "value": null,
  "source": {
    "name": "Mubadala - Mubadala x SailGP (three-year global partnership announced 2023)",
    "date": "2026-09-25",
    "url": "https://www.mubadala.com/en/sailgp"
  },
  "leagueId": "sailgp",
  "note": "Global partner since 2023; title sponsor of the New York and Abu Dhabi Sail Grand Prix and SailGP Inspire; Mubadala-owned Strata Manufacturing (Al Ain) makes F50 hydrofoils and rudders. Renewal status beyond the original three years not published."
}