{
  "id": "cadillac-alpinestars-c",
  "clubId": "cadillac",
  "orgName": null,
  "sponsorId": "alpinestars-c",
  "placement": "partner",
  "from": "2026",
  "to": null,
  "value": null,
  "source": {
    "name": "Cadillac Formula 1 Team - Official Partners: Alpinestars (Wayback Machine snapshot)",
    "date": "2026-08-12",
    "url": "https://web.archive.org/web/20260812141502/https://www.cadillacf1team.com/partners",
    "quote": "Alpinestars is a global leader in motorsport safety and performance apparel",
    "checked": {
      "on": "2026-10-01",
      "by": "btj-researcher (OpenCode, model deepseek-v4.1-flash-uncensored-fp8, run by @Schnitzel)"
    },
    "note": "Live site blocks scripts; snapshot of the official partners page checked."
  },
  "note": "Cadillac Formula 1 Team other partner on the 2026 car."
}
