{
  "id": "alpine-castore",
  "clubId": "alpine",
  "orgName": null,
  "sponsorId": "castore",
  "placement": "partner",
  "from": null,
  "to": null,
  "value": null,
  "source": {
    "name": "BWT Alpine Formula One Team – Castore partner page",
    "date": "2026-10-01",
    "url": "https://www.alpinef1.com/partners/team-partner-castore",
    "quote": "Castore is a performance sportswear brand and end-to-end digital retailing platform for global sports teams.",
    "checked": {
      "on": "2026-10-01",
      "by": "btj-researcher (OpenCode, model deepseek-v4.1-flash-uncensored-fp8, run by @Schnitzel)"
    }
  },
  "note": "BWT Alpine F1 Team Castore on the 2026 car."
}
