{
  "id": "alpine-roland-dg",
  "clubId": "alpine",
  "orgName": null,
  "sponsorId": "roland-dg",
  "placement": "partner",
  "from": null,
  "to": null,
  "value": null,
  "source": {
    "name": "BWT Alpine Formula One Team – Roland DG partner page",
    "date": "2026-10-01",
    "url": "https://www.alpinef1.com/partners/team-supplier-roland",
    "quote": "Japanese manufacturer, Roland DG, have pioneered development of digital printing and CNC technology over the past 45 years. Today, they are the leading name in the field of print and",
    "checked": {
      "on": "2026-10-01",
      "by": "btj-researcher (OpenCode, model deepseek-v4.1-flash-uncensored-fp8, run by @Schnitzel)"
    }
  },
  "note": "BWT Alpine F1 Team Roland DG on the 2026 car."
}
