{
  "id": "crystal-palace-w-temporal",
  "clubId": "crystal-palace-w",
  "orgName": null,
  "sponsorId": "temporal",
  "placement": "front",
  "from": "2026-27",
  "to": null,
  "value": null,
  "source": {
    "name": "Crystal Palace FC: Temporal expands Crystal Palace partnership to become front-of-shirt partner of Palace Women",
    "date": "2026-09-09",
    "url": "https://www.cpfc.co.uk/news/announcement/temporal-expands-crystal-palace-partnership-to-become-front-of-shirt-partner-of-palace-women",
    "quote": "Crystal Palace Football Club are delighted to announce that Temporal will expand its partnership with the Club to become the new front-of-shirt partner of Crystal Palace Women.",
    "checked": {
      "on": "2026-09-30",
      "by": "Schnitzel"
    },
    "note": "Temporal expands its men's front-of-shirt deal to Palace Women; no value reported."
  },
  "note": "Front-of-shirt partner of Crystal Palace Women, announced on 9 Sept 2026 for the 2026/27 season; no deal value reported."
}
