{
  "id": "mclaren-okx",
  "clubId": "mclaren",
  "orgName": null,
  "sponsorId": "okx",
  "placement": "sleeve",
  "from": "2026",
  "to": null,
  "value": null,
  "source": {
    "name": "McLaren Racing – McLaren Racing announces expansion with Official Primary Partner OKX",
    "date": "2023",
    "url": "https://www.mclaren.com/racing/formula-1/2023/mclaren-racing-announces-expansion-with-official-primary-partner-okx"
  },
  "note": "McLaren Mastercard F1 Team sleeve partner on the 2026 car."
}