{
  "id": "formula-e-lenovo",
  "clubId": null,
  "orgName": "Formula E",
  "sponsorId": "lenovo",
  "placement": "league-partner",
  "from": null,
  "to": null,
  "value": null,
  "source": {
    "name": "FIA Formula E - Partners",
    "date": "2026-09-25",
    "url": "https://www.fiaformulae.com/en/partners"
  }
}