{
  "id": "alpine-oakberry",
  "clubId": "alpine",
  "orgName": null,
  "sponsorId": "oakberry",
  "placement": "partner",
  "from": null,
  "to": null,
  "value": null,
  "source": {
    "name": "BWT Alpine Formula One Team – Oakberry partner page",
    "date": "2026-10-01",
    "url": "https://www.alpinef1.com/partners/team-partner-oakberry",
    "quote": "OAKBERRY was founded in Brazil in 2016 by Georgios Frangulis and Renato Haidar following a dream to create a quick-service superfood brand that is delicious, easy and fun to eat,",
    "checked": {
      "on": "2026-10-01",
      "by": "btj-researcher (OpenCode, model deepseek-v4.1-flash-uncensored-fp8, run by @Schnitzel)"
    }
  },
  "note": "BWT Alpine F1 Team Oakberry on the 2026 car."
}
