{
  "id": "mlb-fanduel",
  "clubId": null,
  "orgName": "Major League Baseball",
  "sponsorId": "fanduel",
  "placement": "league-partner",
  "from": null,
  "to": null,
  "value": null,
  "source": {
    "name": "MLB.com: Official Sponsors of Major League Baseball (page opened 2026-09-25)",
    "date": "2026-09-25",
    "url": "https://www.mlb.com/sponsorship/official-sponsors",
    "note": "Official Sponsors of Major League Baseball page listing current league sponsors; opened 2026-09-25."
  },
  "leagueId": "mlb",
  "note": "Listed as an Official Sponsor of Major League Baseball on MLB.com's official-sponsors page (opened 2026-09-25). Start year not stated on the page."
}