{
  "id": "baltimore-ravens-perdue-farms-patch",
  "clubId": "baltimore-ravens",
  "orgName": "Perdue Farms",
  "sponsorId": "perdue-farms",
  "placement": "training-kit",
  "from": "2026",
  "to": null,
  "value": null,
  "source": {
    "name": "Baltimore Ravens (club announcement)",
    "date": "2026-07-20",
    "url": "https://www.baltimoreravens.com/news/ravens-perdue-partnership-team-up-official-chicken-jersey-patch-maryland-food-bank",
    "quote": "The debut of the Perdue logo patch on Ravens practice jerseys, beginning this season.",
    "checked": {
      "on": "2026-10-01",
      "by": "btj-researcher (OpenCode, model mimo-v2.6-flash-rl-uncensored-fp8, run by @Schnitzel)"
    }
  },
  "note": "Practice-jersey patch. Multi-year deal announced 2026-07-20; deal length and value not disclosed by either party."
}
