{
  "id": "alpine-hmn24",
  "clubId": "alpine",
  "orgName": null,
  "sponsorId": "hmn24",
  "placement": "partner",
  "from": null,
  "to": null,
  "value": null,
  "source": {
    "name": "BWT Alpine Formula One Team – HMN24 partner page",
    "date": "2026-10-01",
    "url": "https://www.alpinef1.com/partners/team-supplier-hmn24",
    "quote": "HMN24 was created to address the enormous physiological impacts of circadian misalignment, jet lag, and modern stressors on cellular, cardiovascular, metabolic, and mental.",
    "checked": {
      "on": "2026-10-01",
      "by": "btj-researcher (OpenCode, model deepseek-v4.1-flash-uncensored-fp8, run by @Schnitzel)"
    }
  },
  "note": "BWT Alpine F1 Team HMN24 on the 2026 car."
}
