{
  "id": "rayo-vallecano-gcs",
  "clubId": "rayo-vallecano",
  "orgName": null,
  "sponsorId": "gcs",
  "placement": "sleeve",
  "from": "2023-24",
  "to": null,
  "value": null,
  "source": {
    "name": "Rayo Vallecano official site, 'GCS, nuevo patrocinado del Rayo Vallecano'",
    "date": "2023-09-15",
    "url": "https://www.rayovallecano.es/noticias/gcs-nuevo-patrocinado-del-rayo-vallecano",
    "quote": "El Rayo Vallecano y GCS han firmado un acuerdo que convierte a la empresa vallecana en nuevo patrocinador del Club durante la presente temporada.",
    "checked": {
      "on": "2026-09-28",
      "by": "Schnitzel"
    }
  },
  "note": "Sleeve deal running from 2023-24; still the sleeve sponsor in 2026/27 (Score and Change). Value not disclosed."
}
