{
  "id": "dakar-defender",
  "clubId": null,
  "orgName": "Dakar Rally (ASO)",
  "sponsorId": "defender",
  "placement": "league-partner",
  "from": null,
  "to": null,
  "value": null,
  "source": {
    "name": "dakar.com - Partners (Official Partners: Defender)",
    "date": "2026-09-25",
    "url": "https://www.dakar.com/en/dakar-world/partners",
    "note": "Defender (Land Rover) listed as an Official Partner, linking to landrover.com/defender."
  },
  "leagueId": "dakar-rally",
  "note": "Land Rover brand; JLR is owned by Tata Motors."
}