{
  "id": "sporting-cp-betano-front",
  "clubId": "sporting-cp",
  "orgName": null,
  "sponsorId": "betano",
  "placement": "front",
  "from": "2021",
  "to": "2028-29",
  "value": null,
  "source": {
    "name": "Kaizen Gaming, 'Betano and Sporting CP renew partnership until 2029' (Main Sponsor, branding on the front of both teams' official shirts)",
    "date": "2025-08-08",
    "url": "https://kaizengaming.com/news/betano-and-sporting-cp-renew-partnership-until-2029/"
  },
  "note": "Betano has sponsored Sporting since 2021."
}