{
  "id": "womens-golf-rolex",
  "clubId": null,
  "orgName": "PIF Global Series (Ladies European Tour)",
  "sponsorId": "rolex",
  "placement": "league-partner",
  "from": null,
  "to": null,
  "value": null,
  "leagueId": "womens-golf",
  "note": "Official Partner (pifglobalseries.com footer, fetched 25 Sep 2026; logo links rolex.com). Rolex also backs the Rolex Women's World Golf Rankings cited in series coverage.",
  "source": {
    "name": "PIF Global Series - partners footer",
    "date": "2026-09-25",
    "url": "https://pifglobalseries.com/en-us/"
  }
}