{
  "id": "bal-moroccan-ministry-education",
  "clubId": null,
  "orgName": "Basketball Africa League",
  "sponsorId": "moroccan-ministry-of-national-education",
  "placement": "league-partner",
  "from": null,
  "to": null,
  "value": null,
  "source": {
    "name": "NBA Communications (pr.nba.com): 2026 BAL season - By the Numbers",
    "date": "2026-05-25",
    "url": "https://pr.nba.com/2026-basketball-africa-league-season-numbers/"
  },
  "leagueId": "basketball-africa-league",
  "note": "Institutional partner (Moroccan Ministry of National Education, Preschool and Sport); attached to no single club."
}
