{
  "id": "lecce-dr-automobiles-back",
  "clubId": "lecce",
  "orgName": null,
  "sponsorId": "dr-automobiles",
  "placement": "back",
  "from": "2023",
  "to": null,
  "value": null,
  "source": {
    "name": "US Lecce, 'DR Automobiles Groupe è back sponsor di maglia'",
    "date": "2023-07-25",
    "url": "https://uslecce.it/dr-automobiles-groupe-e-back-sponsor-di-maglia",
    "quote": "DR è infatti il nuovo back sponsor di maglia dell’U.S. Lecce.",
    "checked": {
      "on": "2026-10-03",
      "by": "btj-researcher (OpenCode, model glm-5.3-flash-uncensored-fp8, run by @Schnitzel)"
    }
  },
  "note": "Back-sponsor deal announced 25 Jul 2023, born from the collaboration between club president Saverio Sticchi Damiani and DR Automobiles Groupe president Massimo Di Risio. Still on the shirt in 2026-27 per the club's sponsor page and the official store's product photos. No deal value reported."
}
