{
  "id": "svns-dubai-dubai-holding",
  "clubId": null,
  "orgName": "Emirates Dubai 7s",
  "sponsorId": "dubai-holding",
  "placement": "league-partner",
  "from": null,
  "to": null,
  "value": null,
  "leagueId": "world-rugby",
  "note": "Presenting Partner of the Emirates Dubai 7s.",
  "source": {
    "name": "Emirates Dubai 7s - 2025 date announcement (partner strip)",
    "date": "2026-09-25",
    "url": "https://emiratesdubai7s.com/news/2025-date-announcement/"
  }
}
